check_id,check_type,business_process,dimension_key,ref_table,ref_column,issue_desc,check_sql,check_result,fail_reason,risk_level,handle_decision,handle_action,handle_who,handle_deadline,updated_at
1,缺失维度,全部业务过程,dim_employee,ods_yummy_ods_itf_po_employee_df,employeeid,"所有评分表的evaluator字段为姓名而非ID,无法直接JOIN员工维度表,需建设阶段建立姓名到employeeid的映射","建设阶段需创建evaluator_name到employeeid的映射表,或在DWD层通过模糊匹配建立关联",fail,"源系统评分表中评分人字段存储姓名而非员工ID,缺乏直接FK关联",高,延期,,数仓开发,建设阶段Phase1,2026-04-13
2,缺失维度,全部业务过程,,,,"源系统无供应商主数据表,供应商信息以退化维度形式散落在各评分表中(supplier_name),需建设阶段从评价数据中抽取构建dim_supplier",SELECT DISTINCT supplier_name FROM supplier_evaluation_list 可作为供应商维度种子数据,fail,"缺少独立供应商主数据表,无法构建一致性供应商维度",高,修正,"建设阶段从supplier_evaluation_list抽取唯一供应商列表构建dim_supplier,并生成supplier_id作为代理键",数仓开发,建设阶段Phase1,2026-04-13
3,缺失维度,全部业务过程,,,,"源系统无项目主数据表,项目信息以退化维度形式散落在各评分表中(project_name/project_type/project_stage),需建设阶段构建dim_project","SELECT DISTINCT project_name,project_type,project_stage,our_company_entity FROM supplier_evaluation_list 可作为项目维度种子数据",fail,缺少独立项目主数据表,中,修正,建设阶段从supplier_evaluation_list抽取唯一项目列表构建dim_project,数仓开发,建设阶段Phase1,2026-04-13
4,口径验证,全部业务过程,,,,"源系统所有字段均为varchar(255),评分字段(应为numeric)和金额字段(应为decimal)的数据类型需在DWD层修正","DWD建设时需将*_score字段转为DECIMAL(5,2),contract_amount转为DECIMAL(18,2)",pending,,中,延期,,数仓开发,建设阶段Phase1,2026-04-13
5,粒度唯一性验证,全部业务过程,,,,"所有表当前0行数据,粒度唯一性验证无法执行,需数据入库后复验","SELECT COUNT(*) AS total, COUNT(DISTINCT CONCAT(project_to_be_evaluated,evaluator)) AS grain_distinct FROM ods_yummy_{table_name}",pending,,低,延期,,数仓开发,数据入库后,2026-04-13
6,口径验证,供应商参评登记,,,,"supplier_evaluation_list标记为累积快照事实表(含多个里程碑确认字段),需数据入库后确认行是否随流程推进更新","SELECT COUNT(*) AS total, COUNT(DISTINCT supplier_name||project_name||evaluation_cycle) AS grain_distinct, SUM(CASE WHEN technical_score IS NOT NULL AND commercial_score IS NOT NULL THEN 1 ELSE 0 END) AS completed FROM ods_yummy_supplier_evaluation_list",pending,,中,延期,,数仓开发,数据入库后,2026-04-13
